{"closed_membership_root":{"path":"scopes/physical-ai-v1/state/membership/roots/4570a97ea3b8c9fa1b65a3eb43ba63fa4349bcb41f6de30ee6e407b81cc5da69.json","sha256":"sha256:4570a97ea3b8c9fa1b65a3eb43ba63fa4349bcb41f6de30ee6e407b81cc5da69"},"contract_version":"1.0","coverage":{"closed_complete_through":"2026-09-02","membership_closed_through":"2026-09-02","pending_gaps":[],"provisional_dates":["2026-09-03"],"start_date":"2026-06-14"},"enrichment_root":{"path":"scopes/physical-ai-v1/state/enrichment/roots/b039b64598d87460df27cdbaa6417c17c04839e1bb7d8b3252a674a35211961b.json","sha256":"sha256:b039b64598d87460df27cdbaa6417c17c04839e1bb7d8b3252a674a35211961b"},"feed_id":"physical-ai-arxiv-facts-v1","generated_at":"2026-09-03T04:56:13Z","index_schema_version":"1.0","partitions":[{"manifest_path":"scopes/physical-ai-v1/partitions/2026/06/2026-06-14/manifests/b127a6484836c5baae2e64fe943a04755dec84666ec1ad7991610db8465461e4.json","manifest_sha256":"sha256:b127a6484836c5baae2e64fe943a04755dec84666ec1ad7991610db8465461e4","source_date":"2026-06-14"},{"manifest_path":"scopes/physical-ai-v1/partitions/2026/06/2026-06-15/manifests/081369336d07667753cf67a0fa8720b031c6b1400aa757e6c25ae976f820ae7d.json","manifest_sha256":"sha256:081369336d07667753cf67a0fa8720b031c6b1400aa757e6c25ae976f820ae7d","source_date":"2026-06-15"},{"manifest_path":"scopes/physical-ai-v1/partitions/2026/06/2026-06-16/manifests/943c2d18b50e32f9a91dcca834b682e91579b57b20856f78f598383fe8c8dd64.json","manifest_sha256":"sha256:943c2d18b50e32f9a91dcca834b682e91579b57b20856f78f598383fe8c8dd64","source_date":"2026-06-16"},{"manifest_path":"scopes/physical-ai-v1/partitions/2026/06/2026-06-17/manifests/05a1c2402862cd7cb7b72924225d8089f0023aa0875dc7d454afb88dceabe621.json","manifest_sha256":"sha256:05a1c2402862cd7cb7b72924225d8089f0023aa0875dc7d454afb88dceabe621","source_date":"2026-06-17"},{"manifest_path":"scopes/physical-ai-v1/partitions/2026/06/2026-06-18/manifests/6e26be1664f9ba29aea72b0c951f6528a74c304680a60e12cac08506b9a9eab5.json","manifest_sha256":"sha256:6e26be1664f9ba29aea72b0c951f6528a74c304680a60e12cac08506b9a9eab5","source_date":"2026-06-18"},{"manifest_path":"scopes/physical-ai-v1/partitions/2026/06/2026-06-19/manifests/bd8d60da2f4b3408bb6a517d2e657a5d56e7f12fc3050a3f40eb9554cb234c50.json","manifest_sha256":"sha256:bd8d60da2f4b3408bb6a517d2e657a5d56e7f12fc3050a3f40eb9554cb234c50","source_date":"2026-06-19"},{"manifest_path":"scopes/physical-ai-v1/partitions/2026/06/2026-06-20/manifests/b7a13ace73ec386aca6cbc3ef2c769da274abecd4a67126cb755068d6903c320.json","manifest_sha256":"sha256:b7a13ace73ec386aca6cbc3ef2c769da274abecd4a67126cb755068d6903c320","source_date":"2026-06-20"},{"manifest_path":"scopes/physical-ai-v1/partitions/2026/06/2026-06-21/manifests/c138264c69a4e84928c891b22b4ad2a8bed09464fe5d7c55a2dc2ab23ac7b990.json","manifest_sha256":"sha256:c138264c69a4e84928c891b22b4ad2a8bed09464fe5d7c55a2dc2ab23ac7b990","source_date":"2026-06-21"},{"manifest_path":"scopes/physical-ai-v1/partitions/2026/06/2026-06-22/manifests/2910197d8f6de3fb02f87b865d66361c5cee30c96fd484760c751edfa204bcc5.json","manifest_sha256":"sha256:2910197d8f6de3fb02f87b865d66361c5cee30c96fd484760c751edfa204bcc5","source_date":"2026-06-22"},{"manifest_path":"scopes/physical-ai-v1/partitions/2026/06/2026-06-23/manifests/72e28d3b6e46d5c7222b93ca5dffa7b2a0a11309b14fbe6ecd81eb02238aa17f.json","manifest_sha256":"sha256:72e28d3b6e46d5c7222b93ca5dffa7b2a0a11309b14fbe6ecd81eb02238aa17f","source_date":"2026-06-23"},{"manifest_path":"scopes/physical-ai-v1/partitions/2026/06/2026-06-24/manifests/9538501367574677db92d3d806d9afcd6b5660b093675079105e703fd7ed0737.json","manifest_sha256":"sha256:9538501367574677db92d3d806d9afcd6b5660b093675079105e703fd7ed0737","source_date":"2026-06-24"},{"manifest_path":"scopes/physical-ai-v1/partitions/2026/06/2026-06-25/manifests/ee484ce4a217dfabef2aa0c51caee6f2c206b244a452270312c36309d2bd2a8e.json","manifest_sha256":"sha256:ee484ce4a217dfabef2aa0c51caee6f2c206b244a452270312c36309d2bd2a8e","source_date":"2026-06-25"},{"manifest_path":"scopes/physical-ai-v1/partitions/2026/06/2026-06-26/manifests/171b00c2b9fd0b3f5a3d20fc3666885dd1e1a7bb5f8db46886277d1ef0770493.json","manifest_sha256":"sha256:171b00c2b9fd0b3f5a3d20fc3666885dd1e1a7bb5f8db46886277d1ef0770493","source_date":"2026-06-26"},{"manifest_path":"scopes/physical-ai-v1/partitions/2026/06/2026-06-27/manifests/8053922b5fc616d6756173399152485e9c81ce04711b159d78cb2dbab44b66f1.json","manifest_sha256":"sha256:8053922b5fc616d6756173399152485e9c81ce04711b159d78cb2dbab44b66f1","source_date":"2026-06-27"},{"manifest_path":"scopes/physical-ai-v1/partitions/2026/06/2026-06-28/manifests/e22ba63ac38a726d7d9fec610e6730fc4515c69d04e12d3a290d55b3883adfab.json","manifest_sha256":"sha256:e22ba63ac38a726d7d9fec610e6730fc4515c69d04e12d3a290d55b3883adfab","source_date":"2026-06-28"},{"manifest_path":"scopes/physical-ai-v1/partitions/2026/06/2026-06-29/manifests/21aa0a852eec7d858337d9cf43bf6f022dc0f94921ff2348cb01c4af9e0b3aac.json","manifest_sha256":"sha256:21aa0a852eec7d858337d9cf43bf6f022dc0f94921ff2348cb01c4af9e0b3aac","source_date":"2026-06-29"},{"manifest_path":"scopes/physical-ai-v1/partitions/2026/06/2026-06-30/manifests/c31719ce9e774c8e22ca42169aa743850965569023ecdf6d9076d632bc5c5824.json","manifest_sha256":"sha256:c31719ce9e774c8e22ca42169aa743850965569023ecdf6d9076d632bc5c5824","source_date":"2026-06-30"},{"manifest_path":"scopes/physical-ai-v1/partitions/2026/07/2026-07-01/manifests/f49667bda581b0eb8460defef1b061eaf7b77e3a1e7b1b570d7b20e80dd66d5e.json","manifest_sha256":"sha256:f49667bda581b0eb8460defef1b061eaf7b77e3a1e7b1b570d7b20e80dd66d5e","source_date":"2026-07-01"},{"manifest_path":"scopes/physical-ai-v1/partitions/2026/07/2026-07-02/manifests/b55834db92170ae83d141d243a73c0b285876c5aeb84270293ff980b44a06afa.json","manifest_sha256":"sha256:b55834db92170ae83d141d243a73c0b285876c5aeb84270293ff980b44a06afa","source_date":"2026-07-02"},{"manifest_path":"scopes/physical-ai-v1/partitions/2026/07/2026-07-03/manifests/1e38bdb8248b804188e69e87166fd2afa78024034499f30a028fa77ebc69ddb4.json","manifest_sha256":"sha256:1e38bdb8248b804188e69e87166fd2afa78024034499f30a028fa77ebc69ddb4","source_date":"2026-07-03"},{"manifest_path":"scopes/physical-ai-v1/partitions/2026/07/2026-07-04/manifests/fec92131ede24234953106c6218aec63998f59e4b86bd32cb49fbe7a5ab43b32.json","manifest_sha256":"sha256:fec92131ede24234953106c6218aec63998f59e4b86bd32cb49fbe7a5ab43b32","source_date":"2026-07-04"},{"manifest_path":"scopes/physical-ai-v1/partitions/2026/07/2026-07-05/manifests/59e0507f6dfa8970eca1f58329b2fbc0fa0100c7ad09d88c7541460806151cd6.json","manifest_sha256":"sha256:59e0507f6dfa8970eca1f58329b2fbc0fa0100c7ad09d88c7541460806151cd6","source_date":"2026-07-05"},{"manifest_path":"scopes/physical-ai-v1/partitions/2026/07/2026-07-06/manifests/3d66a8f5fa638e589d776ee293a7a3af81adaabc1b28cc7bed2c41db75247a66.json","manifest_sha256":"sha256:3d66a8f5fa638e589d776ee293a7a3af81adaabc1b28cc7bed2c41db75247a66","source_date":"2026-07-06"},{"manifest_path":"scopes/physical-ai-v1/partitions/2026/07/2026-07-07/manifests/d9bb860e656c3053bbcd3967fddbe1148ca414da0f16687289af87fe93d97850.json","manifest_sha256":"sha256:d9bb860e656c3053bbcd3967fddbe1148ca414da0f16687289af87fe93d97850","source_date":"2026-07-07"},{"manifest_path":"scopes/physical-ai-v1/partitions/2026/07/2026-07-08/manifests/1e347e57a9d881b32f6fab44e592ca150090fae4658729c343b437ff896bf3a3.json","manifest_sha256":"sha256:1e347e57a9d881b32f6fab44e592ca150090fae4658729c343b437ff896bf3a3","source_date":"2026-07-08"},{"manifest_path":"scopes/physical-ai-v1/partitions/2026/07/2026-07-09/manifests/69b27d7cfaddd4ac7c57582947b9693df62fe2f9d391ba03337dcd1353731a9b.json","manifest_sha256":"sha256:69b27d7cfaddd4ac7c57582947b9693df62fe2f9d391ba03337dcd1353731a9b","source_date":"2026-07-09"},{"manifest_path":"scopes/physical-ai-v1/partitions/2026/07/2026-07-10/manifests/21b97abb181670265d88733908535eeccf3e66b84154c3862bce59c529d59f2c.json","manifest_sha256":"sha256:21b97abb181670265d88733908535eeccf3e66b84154c3862bce59c529d59f2c","source_date":"2026-07-10"},{"manifest_path":"scopes/physical-ai-v1/partitions/2026/07/2026-07-11/manifests/80e94d26b41a47cecee751086326cbb699f5a160e1477c2e19d03c8e8cb34584.json","manifest_sha256":"sha256:80e94d26b41a47cecee751086326cbb699f5a160e1477c2e19d03c8e8cb34584","source_date":"2026-07-11"},{"manifest_path":"scopes/physical-ai-v1/partitions/2026/07/2026-07-12/manifests/3c61c7df76ad69eaec23771b7e43a9627bb9042bef55837631fe0a88cadbac17.json","manifest_sha256":"sha256:3c61c7df76ad69eaec23771b7e43a9627bb9042bef55837631fe0a88cadbac17","source_date":"2026-07-12"},{"manifest_path":"scopes/physical-ai-v1/partitions/2026/07/2026-07-13/manifests/2763352d26bb746ef7ec757fa3519931068a5c3616a8ba30aa8650b8fcce3e69.json","manifest_sha256":"sha256:2763352d26bb746ef7ec757fa3519931068a5c3616a8ba30aa8650b8fcce3e69","source_date":"2026-07-13"},{"manifest_path":"scopes/physical-ai-v1/partitions/2026/07/2026-07-14/manifests/86a73d2c48b9ceb33d33afcc38d2e8b8ee9b395baaf4fd0d9a82326d4c0c825d.json","manifest_sha256":"sha256:86a73d2c48b9ceb33d33afcc38d2e8b8ee9b395baaf4fd0d9a82326d4c0c825d","source_date":"2026-07-14"},{"manifest_path":"scopes/physical-ai-v1/partitions/2026/07/2026-07-15/manifests/d406d74a05b3577d39bf898ceebce3bc000dfaf304cbf7f15aa61805e5b80643.json","manifest_sha256":"sha256:d406d74a05b3577d39bf898ceebce3bc000dfaf304cbf7f15aa61805e5b80643","source_date":"2026-07-15"},{"manifest_path":"scopes/physical-ai-v1/partitions/2026/07/2026-07-16/manifests/6868302db9c5873bb4b4656693c96f74316865cf1427e99ad8dbc3c2889c6226.json","manifest_sha256":"sha256:6868302db9c5873bb4b4656693c96f74316865cf1427e99ad8dbc3c2889c6226","source_date":"2026-07-16"},{"manifest_path":"scopes/physical-ai-v1/partitions/2026/07/2026-07-17/manifests/e77da66ea4bcac7d022817c54bd55c01d8983b0987d44aa3889cc7df5cd7f0ed.json","manifest_sha256":"sha256:e77da66ea4bcac7d022817c54bd55c01d8983b0987d44aa3889cc7df5cd7f0ed","source_date":"2026-07-17"},{"manif